rank,avg_score,funny,think,text,synthetic_query,openalex_id,doi,publication_year,justification
1,4.5,4,5,The Ant Odometer: Stepping on Stilts and Stumps,Ants on Stilts: A Study in Altered Navigation Mechanics,https://openalex.org/W2164481380,https://doi.org/10.1126/science.1126912,2006,"The concept of ants using an 'odometer' for navigation is both humorous and fascinating, providing deep insights into animal behavior and navigation."
2,4.5,5,4,Amazon River dolphin love fetishes: From folklore to molecular forensics,Rhino Horn Grooming and Its Correlation with Unicorn Mythology,https://openalex.org/W2058682698,https://doi.org/10.1111/j.1748-7692.2008.00237.x,2008,The folklore surrounding Amazon River dolphins transforming into handsome men is absurdly humorous and invites curiosity about cultural beliefs.
3,4.5,4,5,Women's preference for dominant male odour: effects of menstrual cycle and relationship status,Dynamic Simulation of Interpersonal Magnetism Using Human Pheromone Frequencies,https://openalex.org/W2155676751,https://doi.org/10.1098/rsbl.2005.0332,2005,"The study of women's preferences for male odors based on dominance is both amusing and insightful, tapping into evolutionary psychology."
4,4.5,4,5,Shape morphing of food: Designed surface grooves induce controlled 2D-3D-4D shape changes in a pea protein-based product during drying and frying conditions,Engineering the Perfect Toothpick Density for Optimal Olive Skewering,https://openalex.org/W4410197815,https://doi.org/10.1016/j.foostr.2025.100433,2025,"The concept of morphing food is both humorous and innovative, provoking significant scientific curiosity about food design and sustainability."
5,4.5,4,5,Observational data reveal evidence and parameters of contagious yawning in the behavioral repertoire of captive-reared chimpanzees (Pan troglodytes),A Comparative Analysis of Yawning Patterns Between Cats and Their Owners,https://openalex.org/W2972677134,https://doi.org/10.1038/s41598-019-49698-6,2019,"Contagious yawning in chimpanzees is inherently funny and surprising, and the study provides valuable insights into animal behavior, making it both humorous and thought-provoking."
6,4.5,4,5,Can Superstition Create a Self-Fulfilling Prophecy? School Outcomes of Dragon Children of China,The Effect of Fortune Cookie Wisdom on College Final Examination Scores,https://openalex.org/W2749941972,https://doi.org/10.3386/w23709,2017,"The idea of 'Dragon Children' and their perceived destiny is both humorous and deeply thought-provoking, raising questions about cultural beliefs and their impact on success."
7,4.5,4,5,FoodFab: Creating Food Perception Illusions using Food 3D Printing,Assessment of Human Appetite Suppression in Response to 3D Printed Food Models,https://openalex.org/W3006627009,https://doi.org/10.1145/3313831.3376421,2020,"The concept of using 3D printing to create food perception illusions is quite humorous and innovative, provoking significant thought about food consumption and waste."
8,4.5,4,5,Where Does Time Go When You Blink?,An Ethnographic Investigation of Time Perception in Response to Sequential Rapid Blinks,https://openalex.org/W2905863100,https://doi.org/10.1177/0956797619842198,2019,"The question of where time goes when you blink is both humorous and profound, raising significant questions about perception and consciousness."
9,4.5,4,5,Morphing pasta and beyond,An Investigation into the Optimal Pasta Shape for Maximum Sauce Adhesion,https://openalex.org/W3157291276,https://doi.org/10.1126/sciadv.abf4098,2021,"The concept of morphing pasta structures is inherently funny and absurd, while also being scientifically intriguing, making it a strong candidate for both humor and thought."
10,4.5,5,4,Inside Jokes,Exploring the Decay Function of Humor in Dad Jokes: A Computational Approach,https://openalex.org/W2013580886,https://doi.org/10.1145/2783258.2783388,2015,"The study of humor in cartoon captions is amusing and thought-provoking, as it connects humor with computational models."
11,4.5,4,5,Twitter mood predicts the stock market,A Machine Learning Approach to Predicting Mood Swings Based on Avocado Prices,https://openalex.org/W3036643286,https://doi.org/10.48550/arxiv.1010.3003,2010,"The idea that Twitter mood can predict stock market trends is humorous and insightful, blending social media with economics."
12,4.5,5,4,"Worm Grunting, Fiddling, and Charming—Humans Unknowingly Mimic a Predator to Harvest Bait",The Acoustic Preferences of Earthworms: A Vibrational Symphony,https://openalex.org/W2007187935,https://doi.org/10.1371/journal.pone.0003472,2008,"The concept of 'worm grunting' is inherently humorous and absurd, showcasing a unique human-animal interaction that is both entertaining and thought-provoking."
13,4.5,4,5,Predicting and improving complex beer flavor through machine learning,Aroma Algorithms: Can Artificial Intelligence Predict Gustatory Trends from Smell Profiles?,https://openalex.org/W4393201001,https://doi.org/10.1038/s41467-024-46346-0,2024,"The use of machine learning to predict beer flavor is both amusing and insightful, combining technology with a beloved beverage. It raises interesting questions about flavor perception."
14,4.5,4,5,Overcooling of offices reveals gender inequity in thermal comfort,The Hidden Economic Cost of Office Thermostat Feuds,https://openalex.org/W4200626288,https://doi.org/10.1038/s41598-021-03121-1,2021,The absurdity of overcooling offices leading to gender inequity is both funny and thought-provoking. It highlights a serious issue in workplace design and gender comfort.
15,4.5,4,5,It pays to cheat: tactical deception in a cephalopod social signalling system,Evaluating the Politeness Protocols Enforced by Moon Jellyfish,https://openalex.org/W2133335008,https://doi.org/10.1098/rsbl.2012.0435,2012,"The idea of cuttlefish using deception in courtship is both funny and thought-provoking, highlighting complex social behaviors in animals."
16,4.5,4,5,Nesting chinstrap penguins accrue large quantities of sleep through seconds-long microsleeps,Assessing the Effects of Snoring on Symphony Performances Among Slumbering Seals,https://openalex.org/W4389160650,https://doi.org/10.1126/science.adh0771,2023,The concept of chinstrap penguins accumulating sleep through microsleeps is both amusing and offers significant insights into animal behavior.
17,4.0,3,5,Species interactions and the structure of complex communication networks,The Cacophonic Orchestra: Analyzing Cross-Species Communication in Zoo Populations,https://openalex.org/W2057605409,https://doi.org/10.1073/pnas.1314337111,2014,"The idea of species communicating in complex networks is both humorous and thought-provoking, especially the unexpected findings about signal convergence."
18,4.0,3,5,Social networks reveal cultural behaviour in tool-using dolphins,Dolphins Dressing Up: An Exploration of Marine Mammal Tool Use in Fashion,https://openalex.org/W2014686052,https://doi.org/10.1038/ncomms1983,2012,"The idea of cultural behavior in dolphins is both amusing and insightful, highlighting the complexity of animal societies."
19,4.0,3,5,Why Do Dolphins Carry Sponges?,Dolphins Dressing Up: An Exploration of Marine Mammal Tool Use in Fashion,https://openalex.org/W2116252849,https://doi.org/10.1371/journal.pone.0003868,2008,"The question of why dolphins carry sponges is both humorous and thought-provoking, addressing animal cognition and social behavior."
20,4.0,3,5,Chameleons communicate with complex colour changes during contests: different body regions convey different information,Chameleon Fashion Week: Investigating Color Choice in Natural Camouflage vs. Social Display,https://openalex.org/W2164301065,https://doi.org/10.1098/rsbl.2013.0892,2013,"Chameleons changing color during contests is both humorous and thought-provoking, as it highlights the absurdity of animal communication strategies."
21,4.0,3,5,Selection for Social Signalling Drives the Evolution of Chameleon Colour Change,Chameleon Fashion Week: Investigating Color Choice in Natural Camouflage vs. Social Display,https://openalex.org/W2086518553,https://doi.org/10.1371/journal.pbio.0060025,2008,"The evolutionary aspect of chameleon color change for social signaling is both amusing and insightful, as it combines humor with serious evolutionary biology."
22,4.0,4,4,"A Jungle in There: Bacteria in Belly Buttons are Highly Diverse, but Predictable",Microbial Communities in the Navels of Belly-Button Lint Collectors,https://openalex.org/W2166078786,https://doi.org/10.1371/journal.pone.0047712,2012,"The exploration of belly button bacteria is inherently funny and surprising, while also provoking curiosity about human microbiomes."
23,4.0,3,5,Honey bees selectively avoid difficult choices,Honeybee Decision-Making under the Influence of Caffeine,https://openalex.org/W2025386802,https://doi.org/10.1073/pnas.1314571110,2013,"The idea that honey bees can avoid difficult choices is humorous and thought-provoking, as it suggests a level of cognitive complexity in insects that is surprising."
24,4.0,4,4,The Impact of ‘Selfie’ Tourism on the Behaviour and Welfare of Brown-Throated Three-Toed Sloths,A Comparative Study of Mindfulness Meditation Techniques in Sloths,https://openalex.org/W2901120672,https://doi.org/10.3390/ani8110216,2018,"The concept of sloths being used as photo props is inherently humorous, and it raises important ethical questions about animal welfare."
25,4.0,3,5,African elephants have expectations about the locations of out-of-sight family members,Elephant Memory and the Anecdotal Effects of Forgetting,https://openalex.org/W2106914753,https://doi.org/10.1098/rsbl.2007.0529,2007,"The concept of elephants tracking family members through urine is both amusing and insightful, provoking curiosity about animal cognition."
26,4.0,4,4,On the Velocity of Expanding Spherical Gas Bubbles Rising in Line in Supersaturated Hydroalcoholic Solutions: Application to Bubble Trains in Carbonated Beverages,The Fluid Dynamics of Champagne Bubbles in Opened and Unopened Bottles,https://openalex.org/W2025435391,https://doi.org/10.1021/la990653x,1999,The study of champagne bubbles rising is inherently humorous due to the context of beverages and the absurdity of measuring bubble dynamics. It also raises interesting questions about fluid dynamics.
27,4.0,4,4,Modeling the Kinetics of Bubble Nucleation in Champagne and Carbonated Beverages,The Fluid Dynamics of Champagne Bubbles in Opened and Unopened Bottles,https://openalex.org/W2089491427,https://doi.org/10.1021/jp0640427,2006,"The focus on bubble nucleation in champagne is amusing and relatable, making it a fun topic while also being scientifically intriguing."
28,4.0,3,5,Airflow Dynamics of Human Jets: Sneezing and Breathing - Potential Sources of Infectious Aerosols,Impact of Beard Length on Projectile Droplet Trajectory During Sneezing,https://openalex.org/W2001811610,https://doi.org/10.1371/journal.pone.0059970,2013,"The concept of sneezing as a jet-like airflow is amusing and relatable, especially in the context of infectious disease. It raises important questions about aerosol transmission."
29,4.0,4,4,Acoustical resonances of assorted ancient structures,Experimental Study on the Resonance Frequencies of Bronze Age Yelling,https://openalex.org/W2013322458,https://doi.org/10.1121/1.414642,1996,"The idea that ancient structures might have been used for ritual chanting is both humorous and thought-provoking, blending history with acoustics."
30,4.0,4,4,Super Mario brothers and sisters: Associations between coplaying video games and sibling conflict and affection,The Effect of Obscure Board Games on Sibling Rivalry,https://openalex.org/W2201675519,https://doi.org/10.1016/j.adolescence.2015.12.001,2015,"The concept of sibling relationships influenced by video games is amusing and relatable, and it raises interesting questions about family dynamics and conflict."
31,4.0,3,5,Gender Separation Increases Somatic Growth in Females but Does Not Affect Lifespan in Nothobranchius furzeri,The Influence of Breakup Playlists on Goldfish Longevity,https://openalex.org/W2047522492,https://doi.org/10.1371/journal.pone.0011958,2010,"The concept of gender separation affecting growth in fish is intriguing and could lead to humorous interpretations, while also providing significant scientific insights."
32,4.0,4,4,Predicting Elections: Child's Play!,How Playing with Magnetic Fridge Letters Influences Political Opinion,https://openalex.org/W1968155605,https://doi.org/10.1126/science.1167748,2009,"The idea that children can predict elections based on face ratings is both funny and surprisingly insightful, highlighting the absurdity of adult decision-making."
33,4.0,3,5,Subliminal exposure to national flags affects political thought and behavior,How Playing with Magnetic Fridge Letters Influences Political Opinion,https://openalex.org/W2145143536,https://doi.org/10.1073/pnas.0704679104,2007,"The concept of subliminal national cues affecting political behavior is intriguing and somewhat humorous in its implications, leading to significant insights."
34,4.0,4,4,Predicting Elections: Child's Play!,The Role of Bobblehead Collection in Predicting Election Outcomes,https://openalex.org/W1968155605,https://doi.org/10.1126/science.1167748,2009,"The notion that children's preferences can predict election outcomes is both funny and thought-provoking, challenging assumptions about competence."
35,4.0,4,4,Does National Culture Matter? Restaurant Employees’ Workplace Humor and Job Embeddedness,The Relationship Between Pizza Toppings and Workplace Conflict Resolution,https://openalex.org/W3173567942,https://doi.org/10.1177/10963480211027927,2021,"The interplay of humor and job embeddedness in restaurants is both funny and insightful, especially considering cultural differences."
36,4.0,3,5,Changes in Women's Choice of Dress Across the Ovulatory Cycle: Naturalistic and Laboratory Task-Based Evidence,A Sociopsychological Investigation into the Phenomenon of Mismatched Earring Days,https://openalex.org/W2158412254,https://doi.org/10.1177/0146167208323103,2008,The research on women's clothing choices during ovulation is humorous in its implications and provides significant insights into human behavior and biology.
37,4.0,4,4,Positive affect facilitates creative problem solving.,Analyzing the Role of Seasonal Candle Scents on Creativity in Writers,https://openalex.org/W1996314002,https://doi.org/10.1037//0022-3514.52.6.1122,1987,"The notion that watching comedy can enhance creativity is both funny and insightful, making a clear connection between humor and cognitive function."
38,4.0,4,4,ACOUSTIC ENVELOPE DETECTOR FOR CRISPNESS ASSESSMENT OF BISCUITS,The Acoustic Signature of a Perfectly Toasted Slice of Bread,https://openalex.org/W2144611493,https://doi.org/10.1111/j.1745-4603.2005.00008.x,2005,The use of an Acoustic Envelope Detector to assess biscuit crispness is inherently funny due to the absurdity of the technology applied to a simple snack. It also raises interesting questions about food texture.
39,4.0,3,5,"Increasing the number of masticatory cycles is associated with reduced appetite and altered postprandial plasma concentrations of gut hormones, insulin and glucose",Effects of Synchronized Dining: Does Chewing Rhythm Influence Digestive Efficiency?,https://openalex.org/W2114291884,https://doi.org/10.1017/s0007114512005053,2012,"The idea that chewing more can affect appetite is both amusing and insightful, as it challenges common assumptions about eating."
40,4.0,4,4,Walking with coffee: Why does it spill?,Thermal Dynamics of Coffee Splatter Relative to Cup Size and Frustration Levels,https://openalex.org/W2009767082,https://doi.org/10.1103/physreve.85.046117,2012,"The concept of studying why coffee spills while walking is inherently funny and relatable, and it also delves into fluid dynamics, making it scientifically interesting."
41,4.0,5,3,Post-periapsis pancakes: sustenance for self-gravity in tidal disruption events,A Study on the Gravitational Effects of Pancake Flip Failure Rates,https://openalex.org/W2189635194,https://doi.org/10.1093/mnras/stv2511,2015,"The concept of pancakes in the context of tidal disruption events is absurdly funny and unexpected, though the scientific content is more complex."
42,4.0,4,4,Fast response times signal social connection in conversation,The Sensory Impact of Soup Aroma on the Duration of Remote Phone Conversations,https://openalex.org/W4205725129,https://doi.org/10.1073/pnas.2116915119,2022,"The concept of measuring social connection through response times in conversation is both humorous and insightful, highlighting the quirks of human interaction."
43,4.0,3,5,How quantifying the shape of stories predicts their success,Developing a Computational Model for the Blockbuster Popularity of Classical Greek Rhetoric on Streaming Platforms,https://openalex.org/W3175897018,https://doi.org/10.1073/pnas.2011695118,2021,"Quantifying story shapes is a humorous and creative approach to understanding narratives, provoking significant curiosity."
44,4.0,4,4,The Linguistics of Laughter: A Corpus-Assisted Study of Laughter-Talk,Exploring the Decay Function of Humor in Dad Jokes: A Computational Approach,https://openalex.org/W568203944,https://doi.org/10.4324/9780203966570,2006,"The exploration of laughter in discourse is inherently humorous and insightful, blending linguistics with social interaction."
45,4.0,3,5,Fragmentation of Rods by Cascading Cracks: Why Spaghetti Does Not Break in Half,The Fibonacci Sequence in the Growth Patterns of Spaghetti Breakage,https://openalex.org/W2003783623,https://doi.org/10.1103/physrevlett.95.095505,2005,The unexpected behavior of spaghetti breaking in multiple pieces is amusing and offers a fascinating insight into physics and material science.
46,4.0,3,5,Yawn duration predicts brain weight and cortical neuron number in mammals,A Statistical Examination of the Variability of Yawn Duration Across Different Species,https://openalex.org/W2529064514,https://doi.org/10.1098/rsbl.2016.0545,2016,"The correlation between yawn duration and brain weight is both funny and insightful, as it connects a mundane action to serious neurological implications."
47,4.0,4,4,LEARNING TO LAUGH (AUTOMATICALLY): COMPUTATIONAL MODELS FOR HUMOR RECOGNITION,Investigating the Computational Complexity of Tickling: An Algorithmic Approach,https://openalex.org/W2015089823,https://doi.org/10.1111/j.1467-8640.2006.00278.x,2006,"The attempt to create computational models for humor recognition is both funny and thought-provoking, as it tackles a complex aspect of human behavior."
48,4.0,3,5,Melting of glacier ice enhanced by bursting air bubbles,The Role of Flatulence in Antarctic Ice Sheet Melting,https://openalex.org/W4386498910,https://doi.org/10.1038/s41561-023-01262-8,2023,"The idea that bursting air bubbles could affect glacier melt is surprising and humorous, while also providing significant scientific insight."
49,4.0,3,5,Feathered Detectives: Real-Time GPS Tracking of Scavenging Gulls Pinpoints Illegal Waste Dumping,Pigeons as Urban Cartographers: Mapping Cities Through Droppings,https://openalex.org/W2482938988,https://doi.org/10.1371/journal.pone.0159974,2016,"Using GPS tracking of gulls to detect illegal dumping is both humorous and clever, showcasing an innovative approach to environmental crime detection."
50,4.0,3,5,BitterSweet: Building machine learning models for predicting the bitter and sweet taste of small molecules,Palatable Paradoxes: The Chemistry of Making Bitter Foods Taste Sweet,https://openalex.org/W2951080103,https://doi.org/10.1038/s41598-019-43664-y,2019,"The use of machine learning to predict taste is both amusing and thought-provoking, highlighting the intersection of technology and sensory experiences."
51,4.0,3,5,"Differential effects of exposure to ambient vanilla and citrus aromas on mood, arousal and food choice",Vanilla Vexation: Understanding the Olfactory Effects of Artificial Flavoring on Human Behavior,https://openalex.org/W2153033445,https://doi.org/10.1186/2044-7248-1-24,2012,"The differential effects of vanilla and citrus aromas on mood and food choice is amusing and insightful, revealing the surprising impact of scents on behavior."
52,4.0,3,5,Forty years of olfactory navigation in birds,Olfactory Oddities: The Curious Case of Chemically-Induced Spatial Navigation through Smells,https://openalex.org/W2317688932,https://doi.org/10.1242/jeb.070250,2013,"The idea that pigeons navigate using olfactory cues is both funny and thought-provoking, especially considering how often we underestimate animal senses."
53,4.0,3,5,Chemical Fingerprints of Emotional Body Odor,The Chemistry of Cuddles: Investigating the Role of Smell in Bonding Between People and Pets,https://openalex.org/W3010236843,https://doi.org/10.3390/metabo10030084,2020,"The concept of chemical fingerprints of emotional body odor is both amusing and insightful, raising questions about the connection between emotions and chemical signals."
54,4.0,3,5,Subliminal Smells can Guide Social Preferences,Subliminal Scents: The Effect of Understated Aromas on Decision-Making Processes,https://openalex.org/W2166689112,https://doi.org/10.1111/j.1467-9280.2007.02023.x,2007,"The idea that subliminal smells can influence social preferences is both funny and deeply insightful, as it touches on the subconscious effects of olfaction."
55,4.0,4,4,Cooking Up an Interactive Olfactory Game Display,Sniffing Cyberspace: Virtual Reality Sensations Augmented by Chemical Olfactory Inputs,https://openalex.org/W1992137320,https://doi.org/10.1109/mcg.2008.3,2008,"The concept of an interactive olfactory game display is both humorous and intriguing, as it combines technology with the sense of smell in a playful way."
56,4.0,3,5,Chemical Fingerprints of Emotional Body Odor,Sniffing Out Liars: The Chemical Underpinnings of Deceptive Scent Signatures,https://openalex.org/W3010236843,https://doi.org/10.3390/metabo10030084,2020,"The idea of linking chemical signatures to emotional states is both amusing and thought-provoking, raising questions about human behavior and chemistry."
57,4.0,3,5,Beauty is wealth: CEO attractiveness and firm value,An Empirical Study on the Stock Market Reaction to CEO Footwear Choices,https://openalex.org/W3033675362,https://doi.org/10.1111/fire.12234,2020,The idea that a CEO's attractiveness can impact firm value is amusing and leads to deeper questions about biases in business and the role of appearance in leadership.
58,4.0,3,5,The Light and the Heat: Productivity Co-Benefits of Energy-Saving Technology,Investigating the Economic Benefits of Introducing Competition-Based Workplace Temperature Control,https://openalex.org/W2787867409,https://doi.org/10.1162/rest_a_00886,2019,"The productivity gains from LED lighting on hot days is both amusing and insightful, highlighting unexpected benefits of energy-saving technology."
59,4.0,3,5,Humans recognize emotional arousal in vocalizations across all classes of terrestrial vertebrates: evidence for acoustic universals,Assessing the Emotive Capacities of Cacti During Opera Soliloquies,https://openalex.org/W2645020645,https://doi.org/10.1098/rspb.2017.0990,2017,The idea that humans can recognize emotions across species is amusingly anthropocentric and thought-provoking.
60,4.0,4,4,Self-monitoring and humor production1,Correlation Between Comedic Timing and Accidental Self-inflicted Banana Peel Slips,https://openalex.org/W2087410319,https://doi.org/10.1111/j.1467-6494.1980.tb00825.x,1980,"The study of self-monitoring and humor production is inherently funny, as it examines the humorous person."
61,4.0,4,4,Is That Car Smiling at Me? Schema Congruity as a Basis for Evaluating Anthropomorphized Products,Evaluating the Psychological Stability of Office Supplies When Anthropomorphized,https://openalex.org/W2130653301,https://doi.org/10.1086/518544,2007,"The anthropomorphism of products is a humorous concept that resonates with consumers, making it both funny and thought-provoking."
62,3.5,3,4,Hypocretin/Orexin Overexpression Induces An Insomnia-Like Phenotype in Zebrafish,Do Goldfish Dream of Electric Sheep? Sleep Patterns in Aquarium Residents,https://openalex.org/W2032389394,https://doi.org/10.1523/jneurosci.4332-06.2006,2006,"The idea of studying insomnia in zebrafish is amusing and unexpected, and it raises interesting questions about sleep mechanisms across species."
63,3.5,3,4,Patterns of call communication between group-housed zebra finches change during the breeding cycle,The Cacophonic Orchestra: Analyzing Cross-Species Communication in Zoo Populations,https://openalex.org/W2134908101,https://doi.org/10.7554/elife.07770,2015,"The changing call dynamics of zebra finches during breeding is a humorous take on animal behavior, while also being scientifically interesting."
64,3.5,3,4,Ink secretion by the marine snail Aplysia californica enhances its ability to escape from a natural predator,Snail Trails as Art: A Study on Mollusk-Created Bioluminescent Patterns,https://openalex.org/W2000606301,https://doi.org/10.1007/bf00239926,1995,The concept of a marine snail using ink to escape predators is amusing and highlights an interesting survival strategy.
65,3.5,2,5,The thermodynamics of cognition: A mathematical treatment,The Thermodynamics of Cat Purring and Its Impact on Human Emotion,https://openalex.org/W3120589942,https://doi.org/10.1016/j.csbj.2021.01.008,2021,"The application of thermodynamics to cognition is a surprising and thought-provoking concept, though not inherently humorous."
