rank,avg_score,funny,think,text,synthetic_query,openalex_id,doi,publication_year,justification
1169,2.0,1,3,Mass transfer modeling of equilibrium and dynamic periods during osmotic dehydration of radish in NaCl solutions,The Osmosis of Pickle Juice through Various Sandwich Bread Varieties,https://openalex.org/W2093958871,https://doi.org/10.1016/j.fbp.2012.10.001,2012,"The title is technical and lacks humor, but it may provoke curiosity about food dehydration."
1170,2.0,2,2,Effect of pre-drying on quality of french fries,The Role of Humidity in the Curvature of Curly Fries,https://openalex.org/W2064589794,https://doi.org/10.1016/s0260-8774(00)00233-8,2001,"The study of French fries has a humorous aspect, but the research is quite straightforward and lacks depth."
1171,2.0,1,3,Kinetics and equilibria of tea infusion. Part 3.—Rotating-disc experiments interpreted by a steady-state model,Stochastic Modeling of Cookie Dissolution Rate in Different Tea Temperature Gradients,https://openalex.org/W2051368908,https://doi.org/10.1039/f19827800295,1982,The technical nature of the tea infusion study lacks humor but raises interesting questions about extraction processes.
1172,2.0,1,3,Mathematical modeling of the stability of green tea catechin epigallocatechin gallate (EGCG) during bread baking,Stochastic Modeling of Cookie Dissolution Rate in Different Tea Temperature Gradients,https://openalex.org/W2039077362,https://doi.org/10.1016/j.jfoodeng.2008.01.002,2008,The study of catechin stability during baking is technical but could provoke curiosity about baking chemistry.
1173,2.0,1,3,Fluctuations and phase symmetry in coordinated rhythmic movements.,A Study on the Synchronization Phenomenon during Simultaneously Opened Banana Peelings,https://openalex.org/W4233916369,https://doi.org/10.1037/0096-1523.12.4.564,1986,"The title is technical and lacks humor, but it may provoke thought about movement coordination."
1174,2.0,1,3,A dynamical model for mirror movements,A Study on the Synchronization Phenomenon during Simultaneously Opened Banana Peelings,https://openalex.org/W2054306852,https://doi.org/10.1016/s0167-2789(99)00044-5,1999,"The title is technical and lacks humor, but it could provoke curiosity about motor functions."
1175,2.0,1,3,Salivary buffering capacity and its relation to caries increment in children.,Comparative Analysis of Drool Flow Rates in Infants Exposed to Diverse Candy Types,https://openalex.org/W2411277118,,1987,"The topic of salivary buffering and caries increment is not inherently funny, but it does provoke thought about dental health in children."
1176,2.0,1,3,The effects of physical distance and response latency on persuasion in computer-mediated communication and human–computer communication.,The Sensory Impact of Soup Aroma on the Duration of Remote Phone Conversations,https://openalex.org/W2089991221,https://doi.org/10.1037/1076-898x.5.4.379,1999,"The effects of distance and latency on persuasion are not particularly funny, but they do provoke thought about communication dynamics."
1177,2.0,1,3,Electrophysiological evidence for a facio-facial reflex in the facial muscles in man,The Involuntary Facial Muscle Contractions from Lime Juice Exposure,https://openalex.org/W2071498108,https://doi.org/10.1016/0006-8993(77)90325-0,1977,"The concept of a facial reflex is mildly amusing, but it primarily serves as a scientific inquiry rather than a source of humor."
1178,2.0,1,3,The origin of the abnormal muscle response seen in hemifacial spasm remains controversial,The Involuntary Facial Muscle Contractions from Lime Juice Exposure,https://openalex.org/W2354380463,https://doi.org/10.1016/j.clinph.2016.04.020,2016,"The controversy surrounding muscle responses is a serious topic, but the absurdity of the ongoing debate could be seen as humorous."
1179,2.0,2,2,"A comparison of oral, rectal, and tympanic membrane-derived temperature changes after ingestion of liquids and smoking",An Exploration of the Thermal Effects of Simultaneous Hot and Cold Food Consumption,https://openalex.org/W1989235023,https://doi.org/10.1016/0735-6757(89)90127-7,1989,"The comparison of temperature changes in different body parts is somewhat humorous, but it lacks depth in scientific insight."
1180,2.0,1,3,Acute effect of environmental temperature during exercise on subsequent energy intake in active men,An Exploration of the Thermal Effects of Simultaneous Hot and Cold Food Consumption,https://openalex.org/W2057644198,https://doi.org/10.3945/ajcn.2009.28162,2009,"The influence of environmental temperature on energy intake is an interesting topic, though not particularly humorous."
1181,2.0,1,3,Energetic and Informational Masking in a Simulated Restaurant Environment,The Acoustic Impact of Spaghetti Twirling on Cross-Talk Interference in Shared Dining Spaces,https://openalex.org/W149341804,https://doi.org/10.1007/978-1-4614-1590-9_56,2013,The study of masking in restaurant environments is serious but can provoke curiosity about communication in noisy settings.
1182,2.0,1,3,NUMERICAL SIMULATION OF THE SWALLOWING OF LIQUID BOLUS,Fluid Dynamics in the Slurping of Non-Newtonian Noodle Broths,https://openalex.org/W1552113742,https://doi.org/10.1111/j.1745-4603.2011.00287.x,2011,The study of swallowing thickened liquids is serious but can provoke curiosity about swallowing disorders.
1183,2.0,1,3,Vitamin D 3 enhances mood in healthy subjects during winter,The Seasonal Effect of Eclair Glazing Reflectivity on Human Mood Disorders,https://openalex.org/W1972613582,https://doi.org/10.1007/s002130050517,1998,"The relationship between Vitamin D and mood is interesting, but it lacks humor."
1184,2.0,1,3,BRIGHT LIGHT THERAPY FOR WINTER DEPRESSION: POTENTIAL OCULAR EFFECTS AND THEORETICAL IMPLICATIONS,The Seasonal Effect of Eclair Glazing Reflectivity on Human Mood Disorders,https://openalex.org/W197145455,https://doi.org/10.1111/php.1990.51.6.781,1990,"Light therapy for winter depression is a practical topic, but the potential ocular effects could lead to amusing scenarios if exaggerated."
1185,2.0,1,3,Tea Bud Leaf Identification by Using Machine Learning and Image Processing Techniques,The Statistical Analysis of Tea Leaf Orientations and Fortune Predictions,https://openalex.org/W3049760476,https://doi.org/10.14299/ijser.2020.08.02,2020,"Machine learning for tea bud identification is a serious topic, but the specificity could lead to humorous applications in tea culture."
1186,2.0,1,3,Predicting green tea moisture content during roasting by shape feature,The Statistical Analysis of Tea Leaf Orientations and Fortune Predictions,https://openalex.org/W4401047522,https://doi.org/10.1016/j.jfoodeng.2024.112250,2024,Predicting moisture content in tea leaves is a niche topic that lacks humor but does provoke curiosity about food science.
1187,2.0,1,3,Lunar eclipses and the forecasting of solar minima,Using Monte Carlo Simulations to Predict the Date of the Next Solar Eclipse Based on Astrological Signs,https://openalex.org/W2002965766,https://doi.org/10.1016/0019-1035(65)90045-x,1965,"Lunar eclipses and solar minima could lead to humorous interpretations of astronomical events, though it's primarily scientific."
1188,2.0,1,3,A Statistical Look on ESA's Conjunction Event Predictions,Using Monte Carlo Simulations to Predict the Date of the Next Solar Eclipse Based on Astrological Signs,https://openalex.org/W2900682716,,2013,ESA's conjunction predictions are serious but could be humorously misinterpreted in popular culture.
1189,2.0,1,3,Multiple Universes of Sets and Indeterminate Truth Values,An Analysis of the Statistical Distribution of Non-Existent Numbers in Fictional Universes,https://openalex.org/W52738972,https://doi.org/10.1023/a:1010600724850,2001,Multiple universes and indeterminate truth values are abstract concepts that could inspire humorous philosophical debates.
1190,2.0,1,3,Optimal bird migration revisited,Integer Programming for Optimal Annoyance in Gosling Migration Patterns,https://openalex.org/W2053660974,https://doi.org/10.1007/s10336-011-0694-1,2011,"While the topic of bird migration is serious, the optimization angle could be seen as amusingly over-analytical, provoking some curiosity."
1191,2.0,1,3,Optimization of Seasonal Migratory Behavior,Integer Programming for Optimal Annoyance in Gosling Migration Patterns,https://openalex.org/W2019498819,https://doi.org/10.1086/282464,1967,"The theoretical approach to migration is not humorous, but it does raise interesting questions about animal behavior."
1192,2.0,1,3,Rhetoric in Popular Culture,Developing a Computational Model for the Blockbuster Popularity of Classical Greek Rhetoric on Streaming Platforms,https://openalex.org/W1586200853,https://doi.org/10.2307/358335,1995,"The title suggests a serious academic discussion, lacking humor but providing some potential for insight."
1193,2.0,1,3,Using historical data for bioprocess optimization: Modeling wine characteristics using artificial neural networks and archived process information,Exploring the Use of Deep Learning to Optimize the Process of Uncorking Champagne Bottles,https://openalex.org/W2088712587,https://doi.org/10.1002/1097-0290(20010405)73:1<55::aid-bit1036>3.0.co;2-5,2001,"The title is straightforward and lacks humor, but the application of neural networks in winemaking is an interesting topic."
1194,2.0,1,3,A critical review on the applications of artificial neural networks in winemaking technology,Exploring the Use of Deep Learning to Optimize the Process of Uncorking Champagne Bottles,https://openalex.org/W2469843889,https://doi.org/10.1080/10408398.2015.1078277,2015,"Similar to Paper 13, it lacks humor but offers insights into neural network applications."
1195,2.0,1,3,Deterministic coin tossing and accelerating cascades: micro and macro techniques for designing parallel algorithms,Evaluating the Efficacy of Randomized Algorithms in Sorting Laundry,https://openalex.org/W2022143201,https://doi.org/10.1145/12130.12151,1986,"The title suggests a complex topic without humor, but it could provoke some curiosity about algorithm design."
1196,2.0,1,3,Latent class structures: taste heterogeneity and beyond,The Impact of Statistical Anonymity on the Perceived Taste of Potatoes,https://openalex.org/W571062749,https://doi.org/10.4337/9781781003152.00021,2014,"While the topic is serious, it does hint at interesting complexities in taste, which could provoke some thought."
1197,2.0,1,3,Capturing taste heterogeneity and correlation structure with mixed GEV models,The Impact of Statistical Anonymity on the Perceived Taste of Potatoes,https://openalex.org/W103200792,,2005,The title suggests a complex statistical model which is not inherently funny but could provoke thought about taste analysis.
1198,2.0,1,3,Sibling deidentification and split-parent identification: a family tetrad,A Bayesian Approach to Estimating the Probability of Forgetting a Family Member's Birthday,https://openalex.org/W2215597412,,1982,"The concept of sibling deidentification is intriguing, though not particularly humorous."
1199,2.0,1,3,"Parallel universes. Not just a staple of science fiction, other universes are a direct implication of cosmological observations.",The Geometry of Parallel Universes Reflected in the Arrangement of Office Supplies,https://openalex.org/W2205823357,,2003,"While the concept of parallel universes is intriguing, the title lacks humor."
1200,2.0,1,3,Apriorics and the Proliferation of Elementary Particles in Parallel Subuniverses,The Geometry of Parallel Universes Reflected in the Arrangement of Office Supplies,https://openalex.org/W2054232410,https://doi.org/10.4006/1.3025331,1998,The title suggests a complex idea that could provoke thought but lacks humor.
1201,2.0,1,3,Deterministic models for traffic jams,The Cryptographic Techniques Behind Seemingly Random Traffic Jams,https://openalex.org/W2048436566,https://doi.org/10.1016/0378-4371(93)90006-p,1993,The title suggests a serious analysis of traffic jams but lacks humor.
1202,2.0,1,3,Optimal Scheduling of Domestic Appliances via MILP,Algorithmic Solutions to the Perfectly Imbalanced Balancing of Household Plants,https://openalex.org/W2000027203,https://doi.org/10.3390/en8010217,2014,"The title is technical and lacks humor, but the topic is relevant."
1203,2.0,1,3,A branch-and-bound algorithm for solving the static rebalancing problem in bicycle-sharing systems,Algorithmic Solutions to the Perfectly Imbalanced Balancing of Household Plants,https://openalex.org/W2265976659,https://doi.org/10.1016/j.cie.2016.02.002,2016,"The title is straightforward and lacks humor, but the topic is relevant."
1204,2.0,1,3,Measuring the Similarities Between the Lifetimes of Adult Danish Twins Born Between 1881-1930,The Statistical Validity of Coincidences in Identical Twin Sneezes,https://openalex.org/W4246084744,https://doi.org/10.2307/2290447,1992,The study of Danish twins' lifetimes is not humorous but could spark interest in demographic studies and longevity.
1205,2.0,1,3,Linguistic heuristics of humor: a script-based semantic approach,Exploring the Decay Function of Humor in Dad Jokes: A Computational Approach,https://openalex.org/W2567195896,https://doi.org/10.1515/ijsl-1987-6503,1987,The linguistic heuristics of humor is a niche topic that lacks humor but can provoke thought about language and humor.
1206,2.0,1,3,Modeling the mechanical properties of pasta cooked at different times,The Fibonacci Sequence in the Growth Patterns of Spaghetti Breakage,https://openalex.org/W2026831245,https://doi.org/10.1016/j.jfoodeng.2010.04.019,2010,Modeling pasta cooking times is not humorous but could lead to interesting discussions about food science.
1207,2.0,1,3,Geometrically toughening mechanism of cellular composites inspired by Fibonacci lattice in Liquidambar formosana,The Fibonacci Sequence in the Growth Patterns of Spaghetti Breakage,https://openalex.org/W3106738207,https://doi.org/10.1016/j.compstruct.2020.113349,2020,"The study of cellular composites is serious and technical, lacking humor but offering insights into material science."
1208,2.0,1,3,"Receptive fields, binocular interaction and functional architecture in the cat's visual cortex",Modeling the Micro-Interactions Between Pixels in Cat Videos,https://openalex.org/W2116360511,https://doi.org/10.1113/jphysiol.1962.sp006837,1962,"Research on the cat's visual cortex is serious and lacks humor, but it can provoke curiosity about animal behavior."
1209,2.0,1,3,The world from a cat?s perspective ? statistics of natural videos,Modeling the Micro-Interactions Between Pixels in Cat Videos,https://openalex.org/W2069701241,https://doi.org/10.1007/s00422-003-0434-6,2004,"The perspective of a cat in analyzing natural videos is a unique angle but lacks humor, though it may spark interest."
1210,2.0,1,3,Visual receptive fields and responses to movement in an association area of cat cerebral cortex.,Modeling the Micro-Interactions Between Pixels in Cat Videos,https://openalex.org/W2263886836,https://doi.org/10.1152/jn.1969.32.5.773,1969,Visual receptive fields in cats is a technical topic that lacks humor but can stimulate scientific curiosity.
1211,2.0,1,3,Coupling Digital Human Modeling with Early Design Stage Human Error Analysis to Assess Ergonomic Vulnerabilities,Quantifying the Ergonomics of Sitting Down in Bean Bag Chairs Using Differential Equations,https://openalex.org/W2909188257,https://doi.org/10.2514/6.2019-2349,2019,"The study of human modeling and error analysis is serious and lacks humor, but it can provoke thought about ergonomics."
1212,2.0,1,3,Biomechanical human models for seating discomfort assessment,Quantifying the Ergonomics of Sitting Down in Bean Bag Chairs Using Differential Equations,https://openalex.org/W2970291109,https://doi.org/10.1016/b978-0-12-816713-7.00049-0,2019,"Biomechanical models for seating discomfort are serious and lack humor, but they can provoke thought about comfort design."
1213,2.0,1,3,Optimization of reservation parking space configurations in city centers through an agent-based simulation,The Probabilistic Model of Finding a Parking Spot in a Crowded City,https://openalex.org/W2984830364,https://doi.org/10.1016/j.simpat.2019.102020,2019,Optimizing parking space configurations is a technical subject that lacks humor but can stimulate discussions on city planning.
1214,2.0,1,3,"Convex Polyhedra, Dirichlet Tessellations, and Spider Webs",Non-Euclidean Perspectives on the Geometry of Bed Sheets After a Restless Night,https://openalex.org/W189995339,https://doi.org/10.1007/978-0-387-92714-5_18,2012,"Without an abstract, it's hard to gauge humor, but the combination of convex polyhedra, tessellations, and spider webs could lead to amusing visualizations. The mathematical implications are intriguing."
1215,2.0,1,3,Non-linear dynamic complexity of the human EEG during meditation,The Mathematical Representation of Silence: Quantifying the Unspoken in Guided Meditation,https://openalex.org/W2073254869,https://doi.org/10.1016/s0304-3940(02)00745-0,2002,"The study of EEG during meditation is serious and lacks humor, but it does provoke curiosity about the effects of meditation on brain activity."
1216,2.0,1,3,Reduced functional connectivity between cortical sources in five meditation traditions detected with lagged coherence using EEG tomography,The Mathematical Representation of Silence: Quantifying the Unspoken in Guided Meditation,https://openalex.org/W2007256131,https://doi.org/10.1016/j.neuroimage.2012.01.042,2012,"Without an abstract, it's hard to assess humor, but the topic of EEG and meditation could lead to interesting discussions about mental health."
1217,2.0,1,3,Age-related changes in complexity depend on task dynamics,A Complexity Analysis of Following a Recipe: The Influence of Spices,https://openalex.org/W2112830249,https://doi.org/10.1152/japplphysiol.00244.2004,2004,"The topic of age-related changes in complexity is serious and lacks humor, but it can provoke thought about cognitive aging."
1218,2.0,1,3,"Pauses, gaps and overlaps in conversations",Machine Learning Models for Anticipating Awkward Silences in Conversation,https://openalex.org/W2001292406,https://doi.org/10.1016/j.wocn.2010.08.002,2010,"Without an abstract, it's difficult to assess humor, but the study of conversational dynamics could lead to interesting insights."
1219,2.0,1,3,Mathematical modeling of thin layer drying kinetics of stone apple slices.,A Mathematical Analysis of the Optimal Speed for Nail Polish Drying,https://openalex.org/W1432272504,,2012,"The title suggests a dry topic about drying kinetics, which is not inherently funny. However, the specificity of the subject could provoke curiosity about the science of food preservation."
1220,2.0,1,3,Optimization of single-zone drying of polymer solution coatings using mathematical modeling,A Mathematical Analysis of the Optimal Speed for Nail Polish Drying,https://openalex.org/W2117521986,https://doi.org/10.1002/1097-4628(20001003)78:1<149::aid-app190>3.0.co;2-y,2000,"This paper on optimizing drying conditions is quite technical and lacks humor, but it does offer insights into practical applications of mathematical modeling."
1221,2.0,1,3,Genet and ramet survivorship under different mortality regimes—A cellular automata model,The Impact of Cellular Automata on the Life Expectancy of Virtual Hedgehogs,https://openalex.org/W1993307357,https://doi.org/10.1016/s0022-5193(89)80142-0,1989,"Without an abstract, it's hard to assess humor, but cellular automata models can be complex and potentially amusing in their implications."
1222,2.0,1,3,Convexity in the Theory of Lattice Gases,The Convexity of Bubbles within the Parameters of Bath Time Equilibrium,https://openalex.org/W4301353401,https://doi.org/10.1515/9781400868421,2015,"The topic of convexity in lattice gases is technical and not humorous, but it may provoke curiosity in those interested in physics."
1223,2.0,1,3,"Graphs, Maps, Trees: Abstract Models for a Literary Theory",Graph Theory Applications in Mapping Historical Misunderstandings,https://openalex.org/W1606661733,https://doi.org/10.1111/j.1467-8306.2006.00712_9.x,2006,"Without an abstract, it's hard to assess humor, but the title suggests a theoretical approach that may not be very engaging."
1224,2.0,1,3,Graph Theory and the Interpretation of Regional Survey Data,Graph Theory Applications in Mapping Historical Misunderstandings,https://openalex.org/W2046719604,https://doi.org/10.3406/paleo.1987.4430,1987,"The application of graph theory to archaeological data interpretation is serious and technical, lacking humor but potentially interesting."
1225,2.0,2,2,Neural Networks for Classifying Images of Wood Veneer. Part 2,The Use of Neural Networks to Interpret the Artistry of Kitchen Utensils,https://openalex.org/W2077046267,https://doi.org/10.1007/s001700050174,2000,"The title suggests a technical study on wood veneer classification, which is not inherently humorous but could be seen as absurd in its specificity."
1226,2.0,1,3,"Habitat quality, conspecific density, and habitat pre-use affect the dispersal behaviour of two earthworm species, Aporrectodea icterica and Dendrobaena veneta, in a mesocosm experiment",The Acoustic Preferences of Earthworms: A Vibrational Symphony,https://openalex.org/W2093736886,https://doi.org/10.1016/j.soilbio.2009.10.018,2009,"The study of earthworm behavior is niche and not inherently funny, but it does provoke curiosity about ecological interactions."
1227,2.0,1,3,Sublethal effects of imidacloprid on the burrowing behaviour of two earthworm species: Modifications of the 3D burrow systems in artificial cores and consequences on gas diffusion in soil,The Acoustic Preferences of Earthworms: A Vibrational Symphony,https://openalex.org/W2013690499,https://doi.org/10.1016/j.soilbio.2005.05.014,2005,"The focus on sublethal effects on earthworms is serious, but the topic itself is quirky enough to spark some interest."
1228,2.0,1,3,Root communication among desert shrubs.,Cactus Communication Networks: A Prickly Analysis of Water-Sharing Strategies,https://openalex.org/W2082311942,https://doi.org/10.1073/pnas.88.3.874,1991,"The study of root communication among plants is serious, but the idea of plants 'communicating' is somewhat amusing."
1229,2.0,1,3,The Effect of Neighbors on Root Distribution in a Creosotebush (Larrea Tridentata) Population,Cactus Communication Networks: A Prickly Analysis of Water-Sharing Strategies,https://openalex.org/W2056503695,https://doi.org/10.2307/1939629,1994,"The study of root distribution in plants is serious, but the competitive dynamics could be seen as a humorous take on plant behavior."
1230,2.0,1,3,Microbial oxidation as a methane sink beneath the West Antarctic Ice Sheet,The Role of Flatulence in Antarctic Ice Sheet Melting,https://openalex.org/W2741881999,https://doi.org/10.1038/ngeo2992,2017,"No abstract provided, but methane dynamics under ice is a quirky topic that could provoke curiosity."
1231,2.0,1,3,Initial report on methane and carbon dioxide emission dynamics from sub-Antarctic freshwater ecosystems: A seasonal study of a lake and a reservoir,The Role of Flatulence in Antarctic Ice Sheet Melting,https://openalex.org/W2597531514,https://doi.org/10.1016/j.scitotenv.2017.02.144,2017,"No abstract provided, but the topic of greenhouse gas emissions from freshwater ecosystems is interesting."
1232,2.0,1,3,Wind turbines and coastal recreation demand,Evaluating Wind Turbine Impact on Local Bat Comedy Club Attendance,https://openalex.org/W2133336901,https://doi.org/10.1016/j.reseneeco.2011.10.001,2011,"Without an abstract, it's hard to gauge humor, but the topic of wind turbines and recreation could have some light-hearted aspects."
1233,2.0,1,3,"Reduced breeding success in white-tailed eagles at Smøla windfarm, western Norway, is caused by mortality and displacement",Evaluating Wind Turbine Impact on Local Bat Comedy Club Attendance,https://openalex.org/W1980976567,https://doi.org/10.1016/j.biocon.2011.10.012,2011,The serious nature of the research on eagle breeding success at wind farms lacks humor but raises important ecological questions.
1234,2.0,1,3,The conduction of sap,Investigating Leaf Whispering: Do Trees Tell Secrets?,https://openalex.org/W2327931713,https://doi.org/10.1007/bf00380209,1966,"Without an abstract, it's difficult to assess humor, but the topic of sap conduction could have some quirky elements."
1235,2.0,1,3,EFFECT OF SODIUM NITRITE ON FLAVOR OF CURED PORK,Can Wildfire Smoke Enhance the Flavor Profile of Local BBQs?,https://openalex.org/W2041970248,https://doi.org/10.1111/j.1365-2621.1970.tb04839.x,1970,"The study of sodium nitrite's effect on pork flavor isn't inherently funny, but the specificity of the research may provoke some curiosity about food science and culinary practices."
1236,2.0,1,3,Insights into the comprehensive characteristics of volatile organic compounds from multiple cooking emissions and aftertreatment control technologies application,Can Wildfire Smoke Enhance the Flavor Profile of Local BBQs?,https://openalex.org/W3045135868,https://doi.org/10.1016/j.atmosenv.2020.117646,2020,"Without an abstract, it's hard to gauge humor, but the topic of volatile organic compounds from cooking emissions could be seen as quirky. It does raise some scientific questions about cooking and air quality."
1237,2.0,1,3,Coupling between landslides and eroding stream channels reconstructed from spruce tree rings (examples from the Carpathians and Sudetes – Central Europe),Mudslides as Nature's Tetris: Erosion Patterns Over Time,https://openalex.org/W1746119796,https://doi.org/10.1002/esp.3632,2014,"The study of landslides and erosion is not funny, but it does provide interesting insights into geological interactions that could provoke curiosity."
