rank,avg_score,funny,think,text,synthetic_query,openalex_id,doi,publication_year,justification
388,3.0,2,4,"Olfaction and the ""data"" memory system in rats.",Analysis of the Persistence of Olfactory Memory in Response to Distinctive Foot Odors,https://openalex.org/W2050584490,https://doi.org/10.1037//0735-7044.101.6.757,1987,The idea of rats learning odors in a maze is amusing and raises interesting questions about animal cognition.
389,3.0,2,4,Chronic Caffeine Consumption Prevents Memory Disturbance in Different Animal Models of Memory Decline,Functional Analysis of Caffeine Enhanced Earwig Memory Retrieval Systems,https://openalex.org/W1514696983,https://doi.org/10.3233/jad-2010-1408,2010,Caffeine's effects on memory can be amusing given its cultural association with productivity and alertness. The research is insightful regarding caffeine's role in cognitive function.
390,3.0,2,4,Subjective craving and event-related brain response to olfactory and visual chocolate cues in binge-eating and healthy individuals,Quantifying the Psychological Influence of Cake Aroma on Willpower and Dietary Choices,https://openalex.org/W2584726184,https://doi.org/10.1038/srep41736,2017,"The study on craving and chocolate cues is somewhat humorous due to the relatable struggle with cravings, while also providing insights into eating behaviors."
391,3.0,2,4,Boosting the role of complex food structure on oral breakdown and sweetness perception by digitally designed and 3D printed biscuits,Assessment of Human Appetite Suppression in Response to 3D Printed Food Models,https://openalex.org/W4406930434,https://doi.org/10.1016/j.jfoodeng.2025.112499,2025,"The idea of digitally designed biscuits is amusing and thought-provoking, especially in the context of food science and consumer preferences."
392,3.0,4,2,That’s the way the cookie bounces: Syntactic and semantic components of experimentally elicited idiom blendsß,The Effects of Sleep Deprivation on the Incorrect Usage of Common Idioms,https://openalex.org/W2018624001,https://doi.org/10.3758/bf03197285,1997,"The phrase 'the cookie bounces' is inherently funny, and the study of idiom blends is quirky. However, the scientific insight is limited."
393,3.0,1,5,An animal model for tinnitus,A Bioacoustic Study of Canine Barking Rhythms and Their Potential as a Therapeutic Modality for Tinnitus,https://openalex.org/W2000935754,https://doi.org/10.1288/00005537-198803000-00008,1988,"The development of an animal model for tinnitus is a serious and important scientific endeavor, providing significant insight into a common condition."
394,3.0,1,5,An animal model of tinnitus: a decade of development.,A Bioacoustic Study of Canine Barking Rhythms and Their Potential as a Therapeutic Modality for Tinnitus,https://openalex.org/W2412183714,,1994,"Similar to the previous paper, this one focuses on the long-term development of an animal model for tinnitus, which is critical for understanding this condition."
395,3.0,2,4,Triggering prepared actions by sudden sounds: reassessing the evidence for a single mechanism,The Influence of Sudden Loud Noises on the Voluntary Muscle Reflex Inhibition Phenomenon,https://openalex.org/W2167349638,https://doi.org/10.1111/apha.12627,2015,"The concept of sounds triggering prepared actions is interesting and has a humorous edge, but it mainly provides valuable insights into motor control."
396,3.0,2,4,"The Existence of the StartReact Effect Implies Reticulospinal, Not Corticospinal, Inputs Dominate Drive to Motoneurons during Voluntary Movement",The Influence of Sudden Loud Noises on the Voluntary Muscle Reflex Inhibition Phenomenon,https://openalex.org/W4294295571,https://doi.org/10.1523/jneurosci.2473-21.2022,2022,"The exploration of the StartReact effect is intriguing and has a humorous aspect in the context of animal studies, but it primarily offers scientific insights."
397,3.0,2,4,Social Requests and Social Affordances: How They Affect the Kinematics of Motor Sequences during Interactions between Conspecifics,A Critical Examination of the Etiquette and Efficiency of Multi-Object Handling in Cluttered Prandial Environments,https://openalex.org/W2076497640,https://doi.org/10.1371/journal.pone.0015855,2011,"The study of social requests affecting motor sequences has a quirky aspect, and it raises interesting questions about social interactions."
398,3.0,1,5,Brain dopamine is associated with eating behaviors in humans,The Role of Leftover Pizza as an Adjuvant to Morning Dopaminergic Activity,https://openalex.org/W1987913422,https://doi.org/10.1002/eat.10118,2003,"This paper explores the complex relationship between dopamine and eating behaviors, which is scientifically interesting but not particularly funny."
399,3.0,2,4,Gesture–speech physics in fluent speech and rhythmic upper limb movements,An Investigation of the Elastic Properties of Chewing Gum in the Context of Gestural Communication,https://openalex.org/W3084073798,https://doi.org/10.1111/nyas.14532,2020,"The connection between gesture and speech is interesting and has humorous implications, especially when considering the physicality of communication."
400,3.0,2,4,The Effects of Presleep Slow Breathing and Music Listening on Polysomnographic Sleep Measures – a pilot trial,The Influence of Cartoon Soundtracks on Heartbeat Synchronization During Sleep Induction,https://openalex.org/W3022192232,https://doi.org/10.1038/s41598-020-64218-7,2020,"The combination of breathing techniques and music for sleep is somewhat humorous in its holistic approach, yet scientifically valuable."
401,3.0,2,4,Auditory stimulation with music influences the geometric indices of heart rate variability in men,The Influence of Cartoon Soundtracks on Heartbeat Synchronization During Sleep Induction,https://openalex.org/W2150372757,https://doi.org/10.1186/1755-7682-7-27,2014,The juxtaposition of baroque and heavy metal music's effects on heart rate variability is amusing and prompts curiosity about music's impact.
402,3.0,2,4,The Musician Redefined: A Behavioral Assessment of Rhythm Perception in Professional Club DJs,Investigating the Correlation of Tendon Reflex Response Times with Musical Preference,https://openalex.org/W431674869,https://doi.org/10.1163/22134468-03002041,2015,The concept of DJs being studied for rhythm perception is amusing and highlights the unique skills of this profession.
403,3.0,2,4,BLINKER: Automated Extraction of Ocular Indices from EEG Enabling Large-Scale Analysis,A Comparative Analysis of Laptop Usage and Brainwave Alterations in Different Eyewear Styles,https://openalex.org/W2585964843,https://doi.org/10.3389/fnins.2017.00012,2017,"The automated extraction of ocular indices from EEG data is a bit absurd in its complexity, and it raises interesting questions about the intersection of neuroscience and technology."
404,3.0,2,4,Multichannel harmonic and percussive component separation by joint modeling of spatial and spectral continuity,The Acoustic Properties of Joint Cracking and Its Relation to Household Echo Dynamics,https://openalex.org/W2159310722,https://doi.org/10.1109/icassp.2011.5946376,2011,The idea of separating musical components is somewhat amusing and raises interesting questions about music perception and technology.
405,3.0,2,4,REM-Enriched Naps Are Associated with Memory Consolidation for Sad Stories and Enhance Mood-Related Reactivity,The Effect of Various Sleep Positions on Dream Recall Quality and Frequency,https://openalex.org/W2200952143,https://doi.org/10.3390/brainsci6010001,2015,The notion that naps can enhance memory for sad stories is intriguing and has a touch of humor in its implications about our emotional processing during sleep. It raises interesting questions about the interplay between sleep and mood.
406,3.0,3,3,"Influence of Foot, Leg and Shoe Characteristics on Subjective Comfort",The Psychological Comfort of Symmetrical vs. Asymmetrical Sneaker Wear Patterns,https://openalex.org/W1848662066,https://doi.org/10.1177/107110070002100908,2000,"The study of foot and shoe comfort has a quirky aspect, especially when considering the subjective nature of comfort. However, it doesn't provoke deep scientific curiosity beyond its immediate scope."
407,3.0,2,4,Influence of footwear comfort on the variability of running kinematics,The Psychological Comfort of Symmetrical vs. Asymmetrical Sneaker Wear Patterns,https://openalex.org/W2765238700,https://doi.org/10.1080/19424280.2017.1388296,2017,"Investigating the relationship between footwear comfort and running kinematics is an amusing premise, considering how much thought goes into shoe design. It raises interesting questions about biomechanics."
408,3.0,2,4,Quantifying the Digital Traces of Hurricane Sandy on Flickr,Scale and Dynamics of Personal Item Displacement in Public Restrooms and Its Impact on Social Media Usage,https://openalex.org/W2154101027,https://doi.org/10.1038/srep03141,2013,The analysis of digital traces from Hurricane Sandy is interesting and somewhat humorous in its implications about our digital footprints. It raises questions about data usage in crisis management.
409,3.0,2,4,Space-Time Dependence of Emotions on Twitter after a Natural Disaster,Scale and Dynamics of Personal Item Displacement in Public Restrooms and Its Impact on Social Media Usage,https://openalex.org/W3163830123,https://doi.org/10.3390/ijerph18105292,2021,Studying emotional expressions on Twitter after a disaster is relevant and has a humorous aspect in how we express feelings online. It provides insight into social media's impact on mental health.
410,3.0,2,4,Computational Modeling of Food Oral Breakdown Using Smoothed Particle Hydrodynamics,The Comparative Vibrational Frequencies of Different Soup Types on the Human Palate,https://openalex.org/W1602928049,https://doi.org/10.1111/jtxs.12062,2014,The computational modeling of food breakdown during chewing is an amusingly complex topic that raises questions about food science and sensory experience.
411,3.0,2,4,Measurements of vocal fold tissue viscoelasticity: Approaching the male phonatory frequency range,Beverage Temperature and Its Effect on the Viscosity of Human Whistling,https://openalex.org/W2083418884,https://doi.org/10.1121/1.1736272,2004,The study of vocal fold tissue viscoelasticity is serious but the idea of measuring it in dogs for human phonation is somewhat humorous. It raises interesting questions about voice production.
412,3.0,2,4,The effects of increased fluid viscosity on swallowing sounds in healthy adults,Beverage Temperature and Its Effect on the Viscosity of Human Whistling,https://openalex.org/W2106921951,https://doi.org/10.1186/1475-925x-12-90,2013,"The study of swallowing sounds based on fluid viscosity is an interesting topic, but lacks humor. However, it does provoke thought about the mechanics of swallowing."
413,3.0,2,4,"Natural bites, food consistency and feeding behaviour in man",Effects of Synchronized Dining: Does Chewing Rhythm Influence Digestive Efficiency?,https://openalex.org/W2025904798,https://doi.org/10.1016/0003-9969(95)00112-3,1996,"The study of feeding behavior in humans is somewhat amusing, especially the detailed analysis of jaw movements, while also raising interesting questions about human eating habits."
414,3.0,2,4,Lavender aromatherapy: A systematic review from essential oil quality and administration methods to cognitive enhancing effects,Aromatherapeutic Effects of Burnt Toast on Cognitive Recall During Exams,https://openalex.org/W3203272106,https://doi.org/10.1111/aphw.12310,2021,"Lavender aromatherapy is a common topic, but the systematic review aspect adds depth, making it both amusing and insightful."
415,3.0,2,4,Food perception and emotion measured over time in-lab and in-home,Cheese Stretchability and Its Effect on Emotional Resilience in Pizza Consumers,https://openalex.org/W2919553842,https://doi.org/10.1016/j.foodqual.2019.02.019,2019,"The exploration of eating behavior in context is both amusing and insightful, as it reflects the complexities of human behavior."
416,3.0,2,4,Food as circadian time cue for appetitive behavior,The Biorhythmic Synchronization of Cake Consumption and Memory Recollection,https://openalex.org/W3003659661,https://doi.org/10.12688/f1000research.20829.1,2020,"The idea of food as a circadian cue is amusing and thought-provoking, linking biology with everyday life."
417,3.0,2,4,Heat Transfer in Teeth,Thermodynamic Interactions between Ice Cream and Hot Chocolate within the Oral Cavity,https://openalex.org/W2043776980,https://doi.org/10.1177/00220345730520021101,1973,"The concept of heat transfer in teeth during eating is both amusing and thought-provoking, linking biology with everyday experiences."
418,3.0,2,4,Influences of visual attributes of food packaging on consumer preference and associations with taste and healthiness,The Influence of Breakfast Cereal Color on Perceived Crunchiness,https://openalex.org/W2901225049,https://doi.org/10.1111/ijcs.12500,2018,"While the study of food packaging attributes isn't inherently funny, the absurdity of how much thought goes into packaging design can provoke a chuckle. It also offers valuable insights into consumer behavior."
419,3.0,2,4,Pinch-off dynamics and dripping-onto-substrate (DoS) rheometry of complex fluids,The Effect of Sideburn Length on Soup Dribble Flow Dynamics,https://openalex.org/W2566353178,https://doi.org/10.1039/c6lc01155a,2016,"The concept of pinch-off dynamics in complex fluids has a quirky aspect to it, but it also raises significant questions about fluid dynamics and material science."
420,3.0,2,4,Chaos in ecology: experimental nonlinear dynamics,The Ripple Effect of Spilled Sugar: A Chaos Theory Perspective,https://openalex.org/W1574796356,https://doi.org/10.5860/choice.40-5213,2003,"The concept of chaos in ecology is intriguing and can be seen as humorous in its complexity, while also raising significant scientific questions."
421,3.0,2,4,Invisible grazings and dangerous bifurcations in impacting systems: The problem of narrow-band chaos,The Ripple Effect of Spilled Sugar: A Chaos Theory Perspective,https://openalex.org/W2146896171,https://doi.org/10.1103/physreve.79.037201,2009,"The idea of 'invisible grazings' and chaos in impacting systems is quirky and thought-provoking, raising questions about stability in dynamics."
422,3.0,3,3,Heterogeneous salt distribution in hot snacks enhances saltiness without loss of acceptability,The Effect of Stirring Hand Dominance on Soup Flavor Distribution,https://openalex.org/W1968888434,https://doi.org/10.1016/j.foodres.2013.01.006,2013,"The idea of enhancing saltiness in snacks through uneven distribution is amusing and thought-provoking, as it plays with our perceptions of taste."
423,3.0,2,4,"Moisture, Oil and Energy Transport During Deep-Fat Frying of Food Materials",The Role of Humidity in the Curvature of Curly Fries,https://openalex.org/W2110422373,https://doi.org/10.1205/096030899532475,1999,"The modeling of frying processes has a quirky aspect, and it provides significant insights into food science."
424,3.0,2,4,POROSITY DEVELOPMENT AND ITS EFFECT ON OIL UPTAKE DURING FRYING PROCESS,The Role of Humidity in the Curvature of Curly Fries,https://openalex.org/W2072537649,https://doi.org/10.1111/j.1745-4530.2008.00267.x,2009,The study of porosity in fries is amusing in its specificity and provides valuable insights into cooking.
425,3.0,2,4,Dynamical substructure of coordinated rhythmic movements.,A Study on the Synchronization Phenomenon during Simultaneously Opened Banana Peelings,https://openalex.org/W2000726548,https://doi.org/10.1037//0096-1523.17.3.635,1991,"The study of rhythmic movements has an amusing aspect and delves into complex dynamics, provoking thought."
426,3.0,2,4,Consumption of cocoa flavanols results in acute improvements in mood and cognitive performance during sustained mental effort,The Cognitive and Physical Effects of Marshmallow Density in Hot Chocolate,https://openalex.org/W1988401581,https://doi.org/10.1177/0269881109106923,2009,"The connection between cocoa flavanols and cognitive performance is intriguing, but the humor is minimal. It raises interesting questions about diet and mental function."
427,3.0,2,4,Flavanol-rich chocolate acutely improves arterial function and working memory performance counteracting the effects of sleep deprivation in healthy individuals,The Cognitive and Physical Effects of Marshmallow Density in Hot Chocolate,https://openalex.org/W2340686112,https://doi.org/10.1097/hjh.0000000000000926,2016,"The study on chocolate's effects on cognitive performance after sleep deprivation is interesting, though not particularly funny. It offers valuable insights into nutrition and cognition."
428,3.0,2,4,Sub-Chronic Consumption of Dark Chocolate Enhances Cognitive Function and Releases Nerve Growth Factors: A Parallel-Group Randomized Trial,The Cognitive and Physical Effects of Marshmallow Density in Hot Chocolate,https://openalex.org/W2984985650,https://doi.org/10.3390/nu11112800,2019,"The research on dark chocolate's effects on cognitive function is somewhat amusing in its implications, but primarily it raises significant questions about diet and brain health."
429,3.0,3,3,Taste-elicited tongue movements in human newborn infants: an approach to palatability.,Comparative Analysis of Drool Flow Rates in Infants Exposed to Diverse Candy Types,https://openalex.org/W2440806181,,1973,The idea of studying tongue movements in newborns for palatability is amusingly specific and prompts curiosity about early sensory development.
430,3.0,2,4,"Differential effects of exposure to ambient vanilla and citrus aromas on mood, arousal and food choice",Impact of Doughnut Glaze Patterns on Human Mood Variability,https://openalex.org/W2153033445,https://doi.org/10.1186/2044-7248-1-24,2012,"The differential effects of ambient aromas on mood and food choice is interesting and somewhat amusing, raising questions about sensory environments."
431,3.0,2,4,Restaurant Acoustics &amp;ndash; the Science behind Verbal Communication in Eating Establishments,The Acoustic Impact of Spaghetti Twirling on Cross-Talk Interference in Shared Dining Spaces,https://openalex.org/W2773733082,https://doi.org/10.20944/preprints201712.0011.v1,2017,"The complexity of verbal communication in noisy restaurants is relatable and amusing, while also raising interesting scientific questions."
432,3.0,2,4,High‐speed identification system for fresh tea leaves based on phenotypic characteristics utilizing an improved genetic algorithm,The Statistical Analysis of Tea Leaf Orientations and Fortune Predictions,https://openalex.org/W4281747510,https://doi.org/10.1002/jsfa.12047,2022,"The concept of identifying tea leaves during parabolic flight is absurdly specific, which is funny, while also being scientifically intriguing."
433,3.0,2,4,Analytic Combinatorics of the Mabinogion Urn,The Probability of Drawing a Unicorn in an Infinite Deck of Tarot Cards,https://openalex.org/W2798709193,https://doi.org/10.46298/dmtcs.3591,2008,The idea of an urn model for influence spread is quirky and leads to interesting insights about population dynamics.
434,3.0,2,4,"The Goodreads “Classics”: A Computational Study of Readers, Amazon, and Crowdsourced Amateur Criticism",Developing a Computational Model for the Blockbuster Popularity of Classical Greek Rhetoric on Streaming Platforms,https://openalex.org/W3153865529,https://doi.org/10.22148/001c.22221,2021,The analysis of Goodreads reviews offers a humorous look at literary classification while providing insightful commentary on cultural trends.
435,3.0,2,4,"Applying AI Tools for Modeling, Predicting and Managing the White Wine Fermentation Process",Exploring the Use of Deep Learning to Optimize the Process of Uncorking Champagne Bottles,https://openalex.org/W4220741008,https://doi.org/10.3390/fermentation8040137,2022,The idea of digitalizing wine fermentation is amusing and presents interesting insights into industry challenges.
436,3.0,2,4,The effect of design and demographic factors on consumer sensory scores,The Impact of Statistical Anonymity on the Perceived Taste of Potatoes,https://openalex.org/W2090791954,https://doi.org/10.1071/ea04048,2005,"The idea of analyzing consumer preferences for sheep meat is somewhat amusing and the scale of the study is impressive, prompting curiosity."
437,3.0,2,4,Prioritising family members for genotyping in missing person cases: A general approach combining the statistical power of exclusion and inclusion,A Bayesian Approach to Estimating the Probability of Forgetting a Family Member's Birthday,https://openalex.org/W3085102512,https://doi.org/10.1016/j.fsigen.2020.102376,2020,"The idea of prioritizing family members for genotyping in missing person cases is both serious and somewhat absurd, leading to curiosity."
438,3.0,2,4,Facing the needs for clean bicycle data – a bicycle-specific approach of GPS data processing,Applying Markov Chains to Simulate the Random Walks of Lost Bicycles,https://openalex.org/W3165660323,https://doi.org/10.1186/s12544-020-00462-2,2021,The focus on clean bicycle data processing is somewhat humorous in its specificity and could provoke thought about urban planning.
439,3.0,2,4,A skewed logistic model of two-unit bicycle-vehicle hit-and-run crashes,Applying Markov Chains to Simulate the Random Walks of Lost Bicycles,https://openalex.org/W3123232181,https://doi.org/10.1080/15389588.2020.1852224,2021,The concept of hit-and-run behavior in crashes is serious but the skewed logistic model adds an absurd twist to the analysis.
440,3.0,2,4,Traffic Morphing: An Efficient Defense Against Statistical Traffic Analysis.,The Cryptographic Techniques Behind Seemingly Random Traffic Jams,https://openalex.org/W1608222975,,2009,The idea of morphing traffic to avoid analysis is amusing and thought-provoking regarding privacy.
441,3.0,2,4,Deterministic spontaneous appearance of traffic jams in slightly inhomogeneous traffic flow,The Cryptographic Techniques Behind Seemingly Random Traffic Jams,https://openalex.org/W2001589752,https://doi.org/10.1103/physreve.51.6243,1995,"The deterministic nature of traffic jams is somewhat absurd, leading to curiosity about traffic flow."
442,3.0,2,4,Non-Euclidean geometry of twisted filament bundle packing,Non-Euclidean Perspectives on the Geometry of Bed Sheets After a Restless Night,https://openalex.org/W2006457474,https://doi.org/10.1073/pnas.1205606109,2012,"The idea of twisted filament bundles and their packing geometry is quite unique and could be seen as absurd, especially in the context of everyday materials. It also opens up interesting discussions in material science."
443,3.0,1,5,Pattern Discovery in Internet Background Radiation,Detection of Patterns and Anomalies in the Electromagnetic Fields Emitted by Routers,https://openalex.org/W2726785551,https://doi.org/10.1109/tbdata.2017.2723893,2017,"The topic of Internet Background Radiation is serious and technical, lacking humor but provoking significant curiosity about network security and data analysis."
444,3.0,1,5,EM Monitoring and Classification of IEMI and Protocol-Based Attacks on IEEE 802.11n Communication Networks,Detection of Patterns and Anomalies in the Electromagnetic Fields Emitted by Routers,https://openalex.org/W2921044312,https://doi.org/10.1109/temc.2019.2900262,2019,"This paper addresses serious cybersecurity issues without humor, but it does raise important questions about the vulnerabilities of modern communication systems."
445,3.0,2,4,EDDIE,Detection of Patterns and Anomalies in the Electromagnetic Fields Emitted by Routers,https://openalex.org/W4252100620,https://doi.org/10.1145/3140659.3080223,2017,"The concept of detecting program anomalies through electromagnetic emissions is somewhat amusing in its complexity, and it opens up fascinating discussions about cybersecurity."
446,3.0,2,4,RELIABILITY OF SENSORY ASSESSORS: ISSUES OF COMPLEXITY,A Complexity Analysis of Following a Recipe: The Influence of Spices,https://openalex.org/W2146726133,https://doi.org/10.1111/j.1745-459x.2008.00193.x,2009,The idea that sensory performance declines with product complexity is somewhat amusing and raises interesting questions about human perception.
447,3.0,2,4,Mapping the Semantic Space for the Subjective Experience of Emotional Responses to Odors,Developing a Statistical Model for Predicting Nostalgic Feelings from the Scent of Old Books,https://openalex.org/W2104627969,https://doi.org/10.1093/chemse/bjn052,2008,"Mapping emotional responses to odors is a quirky topic that can be humorous, while also providing insights into human psychology."
448,3.0,2,4,Effects of Fragrance on Emotions: Moods and Physiology,Developing a Statistical Model for Predicting Nostalgic Feelings from the Scent of Old Books,https://openalex.org/W2111457200,https://doi.org/10.1093/chemse/bjh208,2005,"The study of fragrance effects on emotions is somewhat humorous in its implications, while also being scientifically relevant."
449,3.0,2,4,The structure of silence between turns in two‐party conversation,Machine Learning Models for Anticipating Awkward Silences in Conversation,https://openalex.org/W2061412302,https://doi.org/10.1080/01638538609544649,1986,"While the structure of silence might not be overtly funny, the analysis of turn-taking in conversation has a quirky aspect that can be amusing. It also raises interesting questions about social interaction."
450,3.0,2,4,Directed lattice animals in 2 dimensions : numerical and exact results,The Impact of Cellular Automata on the Life Expectancy of Virtual Hedgehogs,https://openalex.org/W2047206312,https://doi.org/10.1051/jphys:0198200430110156100,1982,"The study of directed lattice animals is niche and could be seen as absurd, which adds a layer of humor. It also provides interesting insights into mathematical biology."
