rank,avg_score,funny,think,text,synthetic_query,openalex_id,doi,publication_year,justification
773,2.5,2,3,NON-INVASIVE SAMPLING OF NASAL CILIA FOR MEASUREMENT OF BEAT FREQUENCY AND STUDY OF ULTRASTRUCTURE,Understanding the Mechanical Properties of Nose Tissues in Cold Weather and Their Implications for Virology,https://openalex.org/W2001735366,https://doi.org/10.1016/s0140-6736(80)91995-9,1980,"The idea of non-invasive sampling of nasal cilia is somewhat amusing due to its specificity, and it raises questions about medical research techniques."
774,2.5,2,3,OBSERVATIONS ON THE ALTERNATE ERECTILITY OF NASAL MUCOUS MEMBRANE.,Understanding the Mechanical Properties of Nose Tissues in Cold Weather and Their Implications for Virology,https://openalex.org/W1996137760,https://doi.org/10.1016/s0140-6736(01)72024-7,1901,The alternate erectility of nasal mucous membranes is a quirky topic that could provoke some laughter while also raising questions about nasal physiology.
775,2.5,2,3,Spectrum Analysis of the Cry Sounds of Well-Nourished and Malnourished Infants,The Acoustic Properties of Joint Cracking and Its Relation to Household Echo Dynamics,https://openalex.org/W4254554258,https://doi.org/10.2307/1128305,1976,"The analysis of infant cry sounds is somewhat humorous in its specificity, and it could provoke thought about child development and communication."
776,2.5,2,3,Impact of attachment styles on dream recall and dream content: a test of the attachment hypothesis of REM sleep,The Effect of Various Sleep Positions on Dream Recall Quality and Frequency,https://openalex.org/W2003335876,https://doi.org/10.1046/j.1365-2869.2001.00244.x,2001,"The idea of linking attachment styles to dream recall is somewhat amusing, as it suggests that our emotional baggage might influence our nightly adventures. However, the concept itself is not entirely absurd or surprising."
777,2.5,2,3,Footwear comfort: a systematic search and narrative synthesis of the literature,The Psychological Comfort of Symmetrical vs. Asymmetrical Sneaker Wear Patterns,https://openalex.org/W4200214131,https://doi.org/10.1186/s13047-021-00500-9,2021,A systematic review of footwear comfort sounds dry but can be humorous when considering the vast number of studies on such a niche topic. It does provide some insight into a common issue.
778,2.5,2,3,"Online Activities, Spatial Proximity, and the Diffusion of the Occupy Wall Street Movement in the United States*",Scale and Dynamics of Personal Item Displacement in Public Restrooms and Its Impact on Social Media Usage,https://openalex.org/W2470627791,https://doi.org/10.17813/1086-671x-22-2-139,2016,"The connection between online activities and social movements is a relevant topic, but it lacks a humorous angle. It does provoke thought about modern activism."
779,2.5,1,4,Regional-scale climate-variability synchrony of cholera epidemics in West Africa,Investigation of the Phenomenon of Synchronous Human Sneezing Across Continents and Its Global Implications,https://openalex.org/W2049140494,https://doi.org/10.1186/1471-2334-7-20,2007,The relationship between climate and cholera is serious but has implications that could be seen as surprising. It raises important questions about climate change and health.
780,2.5,1,4,Synchrony of Bird Migration with Global Dispersal of Avian Influenza Reveals Exposed Bird Orders,Investigation of the Phenomenon of Synchronous Human Sneezing Across Continents and Its Global Implications,https://openalex.org/W4391559974,https://doi.org/10.1038/s41467-024-45462-1,2024,"The study of bird migration and avian influenza is serious, but the implications of the findings could provoke thought about ecological health."
781,2.5,2,3,Applying rheology to dough and baked goods.,The Impact of Cheese Density on the Aerodynamics of a Grilled Cheese Sandwich,https://openalex.org/W3162569099,,1988,"The title suggests a potentially dry topic about dough and baked goods, but the absurdity of applying complex rheological principles to something as commonplace as dough could provoke a chuckle while also sparking curiosity about food science."
782,2.5,2,3,Food texture and rheology.,A Quantitative Study on the Elasticity of Pasta: A Correlation with Al Dente Perfection,https://openalex.org/W1577398424,,1979,"Similar to paper 0, the title is somewhat mundane, but the idea of analyzing food texture through rheology could be seen as amusingly over-complicated. It invites thought about the science behind our food."
783,2.5,1,4,Cooked pasta texture : comparison of dynamic viscoelastic properties to instrumental assessment of firmness,A Quantitative Study on the Elasticity of Pasta: A Correlation with Al Dente Perfection,https://openalex.org/W2519261539,,1993,"The comparison of dynamic viscoelastic properties of pasta is quite technical and lacks inherent humor, but it does provoke curiosity about how texture affects our experience of food."
784,2.5,2,3,Food texture and rheology.,An Investigation into the Optimal Pasta Shape for Maximum Sauce Adhesion,https://openalex.org/W1577398424,,1979,"Repetition of a previous title, still mundane but could provoke thought about food texture."
785,2.5,1,4,Cooked pasta texture : comparison of dynamic viscoelastic properties to instrumental assessment of firmness,An Investigation into the Optimal Pasta Shape for Maximum Sauce Adhesion,https://openalex.org/W2519261539,,1993,"Similar to paper 2, it lacks humor but is insightful regarding pasta texture."
786,2.5,2,3,"Sibling competition, parent-offspring conflict and clutch size",The Effect of Remote Sibling Presence on Popcorn Kernel Popping Dynamics,https://openalex.org/W2005616843,https://doi.org/10.1016/s0003-3472(05)80106-x,1992,"Sibling competition and parent-offspring conflict is a serious topic, but the dynamics of family can be humorous, prompting thought about evolutionary biology."
787,2.5,2,3,Sex allocation within broods: the intrabrood sharing-out hypothesis,The Effect of Remote Sibling Presence on Popcorn Kernel Popping Dynamics,https://openalex.org/W2114894315,https://doi.org/10.1093/beheco/arh004,2004,"The concept of parents adjusting offspring sex based on resource competition is intriguing and somewhat humorous, but it also raises serious questions about evolutionary biology."
788,2.5,2,3,The Influence of Essential Oils on Human Vigilance,Aromatherapeutic Effects of Burnt Toast on Cognitive Recall During Exams,https://openalex.org/W173242496,https://doi.org/10.1177/1934578x1000500919,2010,"The title suggests a quirky exploration of essential oils and cognitive performance, which is amusing, but it also invites serious consideration of the effects of scents."
789,2.5,2,3,Linking product-elicited emotional associations and sensory perceptions through a circumplex model based on valence and arousal: Five consumer studies,Cheese Stretchability and Its Effect on Emotional Resilience in Pizza Consumers,https://openalex.org/W2801074655,https://doi.org/10.1016/j.foodres.2018.04.063,2018,The idea of linking emotions and sensory perceptions in consumer studies is somewhat humorous and thought-provoking.
790,2.5,1,4,Involvement of Human Amygdala and Orbitofrontal Cortex in Hunger-Enhanced Memory for Food Stimuli,The Biorhythmic Synchronization of Cake Consumption and Memory Recollection,https://openalex.org/W2103654094,https://doi.org/10.1523/jneurosci.21-14-05304.2001,2001,"The study of hunger's effect on memory is serious but intriguing, provoking thought about the biological basis of memory."
791,2.5,2,3,Temperature extremes produced orally by hot and cold liquids,Thermodynamic Interactions between Ice Cream and Hot Chocolate within the Oral Cavity,https://openalex.org/W2080100390,https://doi.org/10.1016/0022-3913(92)90239-7,1992,The idea of measuring temperature extremes in the mouth is amusing and could provoke curiosity about sensory experiences.
792,2.5,2,3,Crossmodal correspondences in product packaging. Assessing color–flavor correspondences for potato chips (crisps),The Influence of Breakfast Cereal Color on Perceived Crunchiness,https://openalex.org/W2131557117,https://doi.org/10.1016/j.appet.2011.07.012,2011,"The idea of color-flavor correspondences in potato chip packaging is somewhat humorous due to its absurdity, but it also raises interesting questions about consumer perception."
793,2.5,2,3,How Texture Influences Aroma and Taste Perception Over Time in Candies,The Influence of Breakfast Cereal Color on Perceived Crunchiness,https://openalex.org/W2064200515,https://doi.org/10.1007/s12078-011-9086-4,2011,"The exploration of how texture influences taste perception is mildly amusing, but it also touches on significant sensory science, making it thought-provoking."
794,2.5,1,4,Food Properties that Influence Neuromuscular Activity During Human Mastication,An Evaluation of the Resonant Frequencies Produced During Carrot Consumption,https://openalex.org/W2018778629,https://doi.org/10.1177/00220345980770111101,1998,"This paper is quite technical and lacks humor, but it offers important insights into food properties and mastication, which can provoke scientific curiosity."
795,2.5,2,3,Quantitation of Important Roast-Smelling Odorants in Popcorn by Stable Isotope Dilution Assays and Model Studies on Flavor Formation during Popping,A Comparative Analysis of Combustible Odors from Overcooked vs. Burnt Popcorn,https://openalex.org/W1976887373,https://doi.org/10.1021/jf00057a024,1995,"The quantification of popcorn odorants is somewhat amusing due to the specificity of the research, but it also raises interesting questions about flavor chemistry."
796,2.5,2,3,Popcorn flavor: identification of volatile compounds,A Comparative Analysis of Combustible Odors from Overcooked vs. Burnt Popcorn,https://openalex.org/W1969166378,https://doi.org/10.1021/jf60171a048,1970,"Identifying volatile compounds in popcorn is quirky and amusing, and it also contributes to our understanding of food science."
797,2.5,2,3,Relationships of Chewing Sounds to Judgments of Food Crispness,The Interplay of Acoustic Properties and Palatability during the Consumption of Crispy Snacks,https://openalex.org/W1967527115,https://doi.org/10.1111/j.1365-2621.1981.tb04914.x,1981,"The relationship between chewing sounds and food crispness is mildly humorous, and it raises interesting questions about sensory perception."
798,2.5,1,4,Effect of Bread Crumb and Crust Structure on the in Vivo Release of Volatiles and the Dynamics of Aroma Perception,The Chemical Kinetics of Bread Dough Rising under the Influence of Different Musical Genres,https://openalex.org/W2606758516,https://doi.org/10.1021/acs.jafc.7b00287,2017,"The study on aroma perception in bread is not funny, but it offers significant insights into sensory science and food enjoyment."
799,2.5,2,3,The time of day and the proportions of macronutrients eaten are related to total daily food intake,Nutritional Efficiency of Breakfast in Synchrony with Morning Birdsong,https://openalex.org/W2047804555,https://doi.org/10.1017/s0007114507754296,2007,"The relationship between meal timing and total food intake is somewhat amusing, especially considering how people often joke about late-night snacking. It also provides insights into dietary habits."
800,2.5,2,3,Infrequent Breakfast Consumption Is Associated with Higher Body Adiposity and Abdominal Obesity in Malaysian School-Aged Adolescents,Nutritional Efficiency of Breakfast in Synchrony with Morning Birdsong,https://openalex.org/W1990676291,https://doi.org/10.1371/journal.pone.0059297,2013,The association between breakfast habits and obesity in adolescents is a serious topic but has a humorous angle when considering the typical teenage diet. It raises important questions about nutrition.
801,2.5,2,3,Altering Arousal in Humans by Varying Ambient Sensory Conditions,The Psychosomatic Effects of Microwave Popcorn Bag Sound on Anticipation Levels,https://openalex.org/W2020786188,https://doi.org/10.2466/pms.1977.44.1.19,1977,"The exploration of sensory conditions and their effects on arousal can be amusing, especially in a college context, while also providing valuable insights into human behavior."
802,2.5,2,3,"Drinking behavior : oral stimulation, reinforcement, and preference",An Analytical Study of Finger Licking: The Role of Saliva Viscosity and Salt Content,https://openalex.org/W568348723,,1977,"The detailed examination of drinking behavior can be amusing in its complexity, while also providing insights into animal behavior."
803,2.5,2,3,Quantitative corpus data on blend formation: Psycho- and cognitive-linguistic perspectives,The Interaction between Scream Frequency and Milkshake Blend Homogeneity,https://openalex.org/W2498496486,https://doi.org/10.1515/9783110289572.145,2012,"The title suggests a complex analysis of language that could be seen as absurdly academic, but lacks inherent humor. It does provoke curiosity about language formation."
804,2.5,2,3,Characterisation of fresh bread flavour: Relationships between sensory characteristics and volatile composition,The Influence of Time Zones on the Subjective Freshness of Global Sourdough Cultures,https://openalex.org/W2010760781,https://doi.org/10.1016/j.foodchem.2009.02.042,2009,"The study of bread flavor has a light-hearted aspect, but the scientific rigor makes it more serious. It does raise interesting questions about sensory experiences."
805,2.5,2,3,SENSORY PROFILING OF CHANGES IN WHEAT AND WHOLE WHEAT BREAD DURING A PROLONGED PERIOD OF STORAGE,The Influence of Time Zones on the Subjective Freshness of Global Sourdough Cultures,https://openalex.org/W2016539721,https://doi.org/10.1111/j.1745-459x.2009.00254.x,2010,"The sensory profiling of bread over time is somewhat amusing in its detail, but it also raises important questions about food preservation."
806,2.5,2,3,Development of a chewing simulator for food breakdown and the analysis of in vitro flavor compound release in a mouth environment,Bimodal Analysis of Flavor Bursts and Jaw Fatigue in Bubblegum Chewing,https://openalex.org/W2110377769,https://doi.org/10.1016/j.jfoodeng.2007.02.008,2007,"The idea of a chewing simulator is somewhat humorous in its absurdity, as it suggests a level of scientific inquiry into a mundane activity. However, it does provoke thought about food breakdown and flavor release."
807,2.5,2,3,"Eggshell quality: a comparison between Fayoumi, Gimieizah and Brown Hy-Line strains for mechanical properties and ultrastructure of their eggshells",A Study of the Mechanical Properties of Hard-Boiled Eggshells and Their Peelability,https://openalex.org/W2110404785,https://doi.org/10.1071/an14755,2015,"The comparison of eggshell quality across strains is somewhat humorous in its specificity, but it mainly raises questions about poultry science."
808,2.5,2,3,Laboratory Measurements of Eggshell Strength,A Study of the Mechanical Properties of Hard-Boiled Eggshells and Their Peelability,https://openalex.org/W1966510810,https://doi.org/10.3382/ps.0580288,1979,"The focus on eggshell strength is not inherently funny, but it does provoke curiosity about agricultural science."
809,2.5,2,3,The Effect of Glass Colour on the Evaluation of a Beverage’s Thirst-Quenching Quality,The Influence of Ice Cube Transparency on Beverage Appeal under Variable Lighting Conditions,https://openalex.org/W1530472875,https://doi.org/10.4000/cpl.398,2003,"The study on glass color and thirst-quenching perception is somewhat humorous in its specificity, but it raises interesting questions about sensory perception."
810,2.5,2,3,Listening to music can influence hedonic and sensory perceptions of gelati,Impact of Doughnut Glaze Patterns on Human Mood Variability,https://openalex.org/W2282171724,https://doi.org/10.1016/j.appet.2016.02.143,2016,"The idea of music influencing gelato perception is amusing, but lacks depth without an abstract."
811,2.5,2,3,Food perception and emotion measured over time in-lab and in-home,Impact of Doughnut Glaze Patterns on Human Mood Variability,https://openalex.org/W2919553842,https://doi.org/10.1016/j.foodqual.2019.02.019,2019,"The topic of food perception is inherently relatable, and the idea that context affects our eating experience is amusing in its simplicity. However, it doesn't provoke deep scientific curiosity."
812,2.5,1,4,Time Course of Salivary Protein Responses to Cranberry-Derived Polyphenol Exposure as a Function of PROP Taster Status,Molecular Composition Analysis of Delight and Distress during Caramel Sticking to Teeth,https://openalex.org/W3087375030,https://doi.org/10.3390/nu12092878,2020,"While the study of salivary proteins and astringency is quite serious, the complexity of the interactions can be surprising and thought-provoking."
813,2.5,2,3,"Salivary endocannabinoids and<i>N</i>-acylethanolamines upon mastication of a semisolid food: implications in fat taste, appetite and food liking",Molecular Composition Analysis of Delight and Distress during Caramel Sticking to Teeth,https://openalex.org/W2769482931,https://doi.org/10.1039/c7fo01772c,2017,"The idea of salivary endocannabinoids and their relation to food perception is quirky and could elicit a chuckle, but it also raises interesting questions about appetite and taste."
814,2.5,2,3,Paroxysmal Lacrimation During Eating Following Recovery from Facial Paralysis,The Involuntary Facial Muscle Contractions from Lime Juice Exposure,https://openalex.org/W2320033926,https://doi.org/10.1016/s0002-9394(40)90148-9,1940,Paroxysmal lacrimation during eating is an odd phenomenon that can provoke laughter while also sparking curiosity about its causes.
815,2.5,1,4,Information processing in the taste system of primates,Neural Response Patterns to Simultaneous Consumption of Sweet and Sour Flavors,https://openalex.org/W2141241989,https://doi.org/10.1242/jeb.146.1.141,1989,"The detailed analysis of primate taste responses is serious but can be surprising in its complexity, leading to genuine scientific interest."
816,2.5,1,4,Neural correlates of gustatory intensity and quality.,Neural Response Patterns to Simultaneous Consumption of Sweet and Sour Flavors,https://openalex.org/W2402412060,https://doi.org/10.1152/jn.1970.33.6.768,1970,"Similar to paper 7, this study on gustatory intensity and quality is serious but reveals interesting insights into taste processing."
817,2.5,1,4,Processing of Hedonic and Chemosensory Features of Taste in Medial Prefrontal and Insular Networks,Neural Response Patterns to Simultaneous Consumption of Sweet and Sour Flavors,https://openalex.org/W2089732666,https://doi.org/10.1523/jneurosci.2974-13.2013,2013,The exploration of taste processing in the brain is serious but can provoke curiosity about how we perceive flavors.
818,2.5,2,3,The influence of serial feeding of drinks at different temperatures on thermoregulatory responses during cycling,An Exploration of the Thermal Effects of Simultaneous Hot and Cold Food Consumption,https://openalex.org/W2165670657,https://doi.org/10.1080/02640410701697388,2008,The study of thermoregulation during exercise with drinks of varying temperatures is quirky and could elicit laughter.
819,2.5,2,3,Acoustic Comfort in Atria Covered by Novel Structural Skins,The Acoustic Impact of Spaghetti Twirling on Cross-Talk Interference in Shared Dining Spaces,https://openalex.org/W2516478249,https://doi.org/10.1016/j.proeng.2016.08.039,2016,"The concept of acoustic comfort in busy environments is amusing, especially with the reference to the Lombard effect."
820,2.5,2,3,Foodstuffs. Detection of irradiated food using photostimulated luminescence,Comparative Studies on the Luminance of Salad Dressing Spills under Infrared Lighting,https://openalex.org/W2181875403,https://doi.org/10.3403/02669311,2002,The idea of detecting irradiated food using photostimulated luminescence is quirky and could lead to humorous situations in food safety.
821,2.5,2,3,Visible light as a new tool to maintain fresh-cut lettuce post-harvest quality,Comparative Studies on the Luminance of Salad Dressing Spills under Infrared Lighting,https://openalex.org/W2755852959,https://doi.org/10.1016/j.postharvbio.2017.08.024,2017,"Using visible light to maintain lettuce quality is a bit absurd, which adds humor, while also raising questions about food preservation."
822,2.5,1,4,An Assessment of High Dynamic Range Luminance Measurements with LED Lighting,Comparative Studies on the Luminance of Salad Dressing Spills under Infrared Lighting,https://openalex.org/W1978602916,https://doi.org/10.1080/15502724.2014.861279,2013,"While the research is technical, the absurdity of measuring luminance with HDRI for LED lighting can provoke thoughts about technology's quirks."
823,2.5,1,4,The effect of sleep–wake intraindividual variability in digital cognitive behavioral therapy for insomnia: a mediation analysis of a large-scale RCT,Algorithmic Approaches to Counting Sheep as a Sleep Aid: A Randomized Controlled Trial,https://openalex.org/W3163125266,https://doi.org/10.1093/sleep/zsab118,2021,The study on cognitive behavioral therapy for insomnia is serious but can provoke thoughts about sleep habits and their absurdities.
824,2.5,2,3,Will Involving Physical Products Improve the Effects of Counting Sheep on Promoting Sleep: A Design Experiment,Algorithmic Approaches to Counting Sheep as a Sleep Aid: A Randomized Controlled Trial,https://openalex.org/W4411104055,https://doi.org/10.1007/978-3-031-93227-4_28,2025,"The idea of improving sheep counting for sleep is amusingly absurd, while also being a genuine inquiry into sleep science."
825,2.5,2,3,"Insomnia: The quarter of an hour rule (QHR), a single component of stimulus control, improves sleep",Algorithmic Approaches to Counting Sheep as a Sleep Aid: A Randomized Controlled Trial,https://openalex.org/W2899137644,,2006,"The quarter of an hour rule for insomnia is a quirky take on sleep problems, which adds humor to a serious topic."
826,2.5,1,4,The complexity of promise problems with applications to public-key cryptography,The Computational Complexity of Finding Your Keys When You're Late,https://openalex.org/W2010699490,https://doi.org/10.1016/s0019-9958(84)80056-x,1984,Promise problems in cryptography are complex but can lead to humorous interpretations of security in everyday life.
827,2.5,1,4,In search of an easy witness: exponential time vs. probabilistic polynomial time,The Computational Complexity of Finding Your Keys When You're Late,https://openalex.org/W2158747250,https://doi.org/10.1016/s0022-0000(02)00024-7,2002,The comparison of exponential time vs. probabilistic polynomial time is a serious topic that could humorously reflect on computational limits.
828,2.5,1,4,The Spatial Complexity of Oblivious <i>k</i>-Probe Hash Functions,The Computational Complexity of Finding Your Keys When You're Late,https://openalex.org/W2079301493,https://doi.org/10.1137/0219054,1990,"Spatial complexity in hash functions is technical, but the implications can lead to humorous takes on data storage."
829,2.5,2,3,Detecting density dependence in imaginary worlds,An Analysis of the Statistical Distribution of Non-Existent Numbers in Fictional Universes,https://openalex.org/W2005945227,https://doi.org/10.1038/338016a0,1989,"Detecting density dependence in imaginary worlds is absurdly humorous, while also provoking thoughts about theoretical frameworks."
830,2.5,2,3,"The reader&apos;s feeling and text-based emotions : the relationship between subjective self-reports, lexical ratings, and sentiment analysis",Modeling the Emotional State of Artificial Intelligence Using Sentiment Analysis on Cat Videos,https://openalex.org/W2994808143,https://doi.org/10.21256/zhaw-18859,2019,"The idea of combining sentiment analysis with emotional valence prediction is interesting and has practical applications, but the humor is minimal."
831,2.5,2,3,"Recurrence, controllability, and stabilization of juggling",The Conundrum of Infinite Series in Dancing: Optimal Twirling Strategies,https://openalex.org/W2160555037,https://doi.org/10.1109/70.928557,2001,"Juggling as a subject for mathematical analysis is somewhat humorous, and it does lead to interesting insights about control systems."
832,2.5,2,3,The Yo-Yo Intermittent Tests: A Systematic Review and Structured Compendium of Test Results,Statistical Significance of Mathematically Defying Gravity: Uncovering the Secrets to Exceptional Yo-Yo Stunts,https://openalex.org/W2854623544,https://doi.org/10.3389/fphys.2018.00870,2018,"The Yo-Yo test is a quirky topic, and while it has serious applications, the idea of a systematic review of such tests has a humorous undertone."
833,2.5,2,3,Attitudes and Emotions as Determinants of Nostalgia Purchases: An Application of Social Identity Theory,The Application of Machine Learning in Predicting Future Trends in Nostalgia,https://openalex.org/W1983953313,https://doi.org/10.2753/mtp1069-6679150201,2007,"The connection between nostalgia and consumer behavior is relatable and somewhat humorous, while also providing interesting insights."
834,2.5,2,3,Satins and Twills: An Introduction to the Geometry of Fabrics,Unraveling the Mathematical Mysteries of Where Socks Go: A Topological Approach,https://openalex.org/W2314105733,https://doi.org/10.1080/0025570x.1980.11976845,1980,"The title suggests a humorous take on fabric geometry, which is inherently absurd. However, the mathematical nature of the research may not provoke deep scientific curiosity."
835,2.5,2,3,University of British Columbia,The Probability of Drawing a Unicorn in an Infinite Deck of Tarot Cards,https://openalex.org/W4293580211,https://doi.org/10.1227/00006123-197907010-00118,1979,"The concept of shuffling cards in a complex mathematical way is somewhat amusing, but the technical nature limits deeper insight."
